{
  "captured_at": "2026-10-18T19:13:18.115499+00:00",
  "cleanup": {
    "status": "NOT_APPLICABLE"
  },
  "credential_digest": "sha256:b27033322a421fcdbf7c8a2f5347a34715a37b1798c3bda1cf1dd39e781909a3",
  "credential_source": "file:path:29f247d18d3c",
  "errors": [],
  "execution_host": "mac.lan",
  "identity": {
    "id": 6,
    "username": "spyroot",
    "web_url": "https://gitlab.dcloud.run/spyroot"
  },
  "kind": "gitlab_runner",
  "mutated": true,
  "operation": "delete",
  "origin": "https://gitlab.dcloud.run",
  "phase": "APPLY",
  "plan": {
    "body_sha256": "62faba5c6b37436df73346dc65a66ecb29e36982b600db1c72fb9e21cf967e71",
    "confirmation_ready": true,
    "fields": [
      "description"
    ],
    "one_time_sink_required": false,
    "operation": "delete",
    "plan_digest": "d134d87fd8f220ccabbcf91d61765a57bd41cd441be00e192a657c35a6094ca8",
    "project_ids": null,
    "resource_id": 93,
    "runner_snapshot": {
      "description": "ci-skills-30ccd8e1-20261018T190917Z-runner",
      "id": 93,
      "present": true,
      "project_ids": [
        123,
        124
      ],
      "runner_type": "project_type"
    },
    "target_kind": "project",
    "target_reference": "hott/test"
  },
  "plan_digest": "d134d87fd8f220ccabbcf91d61765a57bd41cd441be00e192a657c35a6094ca8",
  "readback": {
    "action": "APPLIED",
    "after": {
      "global_get_status": 404,
      "scoped_absent": true,
      "verified": true,
      "write_error": null
    },
    "before": {
      "access_level": "not_protected",
      "architecture": null,
      "contacted_at": null,
      "description": "ci-skills-30ccd8e1-20261018T190917Z-runner",
      "id": 93,
      "is_shared": false,
      "job_execution_status": "idle",
      "online": null,
      "paused": false,
      "platform": null,
      "projects": [
        124,
        123
      ],
      "runner_type": "project_type",
      "status": "never_contacted",
      "tag_list": [
        "ci-skills",
        "30ccd8e1"
      ],
      "version": null
    },
    "id": 93,
    "mutated": true,
    "verified": true
  },
  "records": [
    {
      "action": "APPLIED",
      "after": {
        "global_get_status": 404,
        "scoped_absent": true,
        "verified": true,
        "write_error": null
      },
      "before": {
        "access_level": "not_protected",
        "architecture": null,
        "contacted_at": null,
        "description": "ci-skills-30ccd8e1-20261018T190917Z-runner",
        "id": 93,
        "is_shared": false,
        "job_execution_status": "idle",
        "online": null,
        "paused": false,
        "platform": null,
        "projects": [
          124,
          123
        ],
        "runner_type": "project_type",
        "status": "never_contacted",
        "tag_list": [
          "ci-skills",
          "30ccd8e1"
        ],
        "version": null
      },
      "id": 93,
      "mutated": true,
      "verified": true
    }
  ],
  "result_action": "APPLIED",
  "schema_version": "1.0",
  "skill": {
    "algorithm": "sha256-tree-v1",
    "consuming_project": {
      "commit": null,
      "source": null
    },
    "digest": "b19198a7e05e618d470c090d31baac0511e4fc867e562be0fbbfd14991af03a8",
    "file_count": 219,
    "functional_digest": "33dd8b7910f6936f2b513408e92b6748781ea908179f35b33ea8c1014eb53bc4",
    "revision": {
      "source": "installer_record",
      "value": "30ccd8e19f8674c0e8cab2d6bcd79f0ef59b1d58",
      "verified": true
    }
  },
  "status": "PASS",
  "summary": {
    "error_count": 0,
    "record_count": 1
  },
  "target": {
    "kind": "project",
    "reference": "hott/test"
  },
  "target_file": "path:37eaf6f0e828",
  "target_source": "project;argv:--project",
  "tested_revision": "30ccd8e19f8674c0e8cab2d6bcd79f0ef59b1d58",
  "verified_target": {
    "full_path": "hott/test",
    "id": 123,
    "kind": "project",
    "web_url": "https://gitlab.dcloud.run/hott/test"
  }
}
