{
  "captured_at": "2026-10-18T21:56:21.637598+00:00",
  "cleanup": {
    "status": "NOT_APPLICABLE"
  },
  "credential_digest": "sha256:b27033322a421fcdbf7c8a2f5347a34715a37b1798c3bda1cf1dd39e781909a3",
  "credential_source": "file:path:29f247d18d3c",
  "errors": [],
  "execution_host": "mac.lan",
  "identity": {
    "id": 6,
    "username": "spyroot",
    "web_url": "https://gitlab.dcloud.run/spyroot"
  },
  "kind": "gitlab_runner",
  "mutated": false,
  "operation": "delete",
  "origin": "https://gitlab.dcloud.run",
  "phase": "APPLY",
  "plan": {
    "body_sha256": "62faba5c6b37436df73346dc65a66ecb29e36982b600db1c72fb9e21cf967e71",
    "confirmation_ready": true,
    "fields": [
      "description"
    ],
    "one_time_sink_required": false,
    "operation": "delete",
    "plan_digest": "5ee484b19da5eda2e0dc877f140a0c6527224945f8e183e73262871beff8b4d9",
    "project_ids": null,
    "resource_id": 95,
    "runner_snapshot": {
      "id": 95,
      "present": false
    },
    "target_kind": "project",
    "target_reference": "hott/test"
  },
  "plan_digest": "5ee484b19da5eda2e0dc877f140a0c6527224945f8e183e73262871beff8b4d9",
  "readback": {
    "action": "NO_OP",
    "after": {
      "global_get_status": 404,
      "scoped_absent": true
    },
    "before": null,
    "id": 95,
    "mutated": false,
    "verified": true
  },
  "records": [
    {
      "action": "NO_OP",
      "after": {
        "global_get_status": 404,
        "scoped_absent": true
      },
      "before": null,
      "id": 95,
      "mutated": false,
      "verified": true
    }
  ],
  "result_action": "NO_OP",
  "schema_version": "1.0",
  "skill": {
    "algorithm": "sha256-tree-v1",
    "consuming_project": {
      "commit": null,
      "source": null
    },
    "digest": "a034ab750654ed12a5eaffad51e5f48ef4aac8e99984aa7f601b69c9c8337631",
    "file_count": 218,
    "functional_digest": "9e28e57e6fbf4ea4e3de0ad155fd2d95bf2353bd7eb1503814ea9e81f301c07e",
    "revision": {
      "source": "installer_record",
      "value": "d1b2c6fb4e47836a68140873c220935463ebff81",
      "verified": true
    }
  },
  "status": "PASS",
  "summary": {
    "error_count": 0,
    "record_count": 1
  },
  "target": {
    "kind": "project",
    "reference": "hott/test"
  },
  "target_file": "path:d6e4cdad550e",
  "target_source": "project;argv:--project",
  "tested_revision": "d1b2c6fb4e47836a68140873c220935463ebff81",
  "verified_target": {
    "full_path": "hott/test",
    "id": 123,
    "kind": "project",
    "web_url": "https://gitlab.dcloud.run/hott/test"
  }
}
